cast,certificates,director,genres,image,plot outline,rating,runtime,title,votes,year,id
"['Denzel Washington', 'Will Patton', 'Wood Harris', 'Ryan Hurst']","['Argentina:Atp', 'Australia:PG', 'Brazil:Livre', 'Canada:PG::(Alberta)', 'Canada:G::(British Columbia)', 'Denmark:7', 'Egypt:PG::(self-applied)', 'Finland:K-7', 'France:Tous publics', 'Germany:6', 'Hong Kong:I', 'Iceland:L', 'India:U', 'Italy:T', 'Japan:G::(self-applied)', 'Malaysia:U', 'Mexico:A', 'Netherlands:AL', 'New Zealand:PG', 'Nigeria:G', 'Norway:11', 'Peru:Apt', 'Philippines:G', 'Poland:12::(self-applied)', 'Portugal:M/12', 'Russia:12+', 'Saudi Arabia:G', 'Singapore:PG', 'South Africa:PG::(self-applied)', 'South Korea:12', 'Spain:7', 'Sweden:7', 'Switzerland:10::(canton of Geneva)', 'Switzerland:10::(canton of Vaud)', 'Turkey:G', 'United Kingdom:PG', 'United States:PG', 'United States:TV-PG::(TV rating)', 'United States:Unrated', 'United Arab Emirates:PG::(DVD rating)']",['Boaz Yakin'],"['Biography', 'Drama', 'Sport']",https://m.media-amazon.com/images/M/MV5BYThkMzgxNjEtMzFiOC00MTI0LWI5MDItNDVmYjA4NzY5MDQ2L2ltYWdlL2ltYWdlXkEyXkFqcGdeQXVyMTQxNzMzNDI@.jpg,"A high school football team is forced to integrate, bringing together players from different racial backgrounds. Coach Boone, played by Denzel Washington, takes charge and helps the team overcome their differences and work together. Amidst challenges and resistance, the players learn to respect and support each other. Through hard work and determination, they become a united team, overcoming prejudice and achieving success on the field. The movie shows how sports can bring people together and promote understanding, even in the face of adversity.",7.8,['113'],Remember the Titans,225512,2000,54
"['Harrison Ford', 'Sean Young', 'Rutger Hauer', 'Edward James Olmos']","['Argentina:18', 'Argentina:16', 'Australia:M', 'Brazil:14', 'Brazil:14', 'Canada:14A::(British Columbia)', 'Canada:PA::(Manitoba)', 'Canada:14::(Nova Scotia)', 'Canada:14A::(Nova Scotia)', 'Canada:AA::(Ontario)', 'Canada:13+::(Quebec)', 'Canada:14+::(TV rating)', 'Chile:16+::(Netflix self-rating)', 'Chile:14', 'Costa Rica:15+', 'Denmark:15::(DVD and Blu-ray rating)', 'Denmark:15', 'Egypt:R::(self-applied)', 'Finland:K-16', 'Finland:K-16::(DVD and Blu-ray rating)', 'France:Tous publics avec avertissement', 'Germany:12', 'Greece:K-16', 'Hong Kong:IIB', 'Hungary:16', 'Iceland:16', 'India:UA', 'India:A', 'Ireland:15', 'Ireland:15A', 'Israel:PG', 'Italy:T', 'Japan:R-15', 'Japan:G', 'Kuwait:18+', 'Malaysia:18', 'Maldives:12+', 'Mexico:C', 'Mexico:B15', 'Netherlands:12', 'Netherlands:16', 'New Zealand:M', 'New Zealand:R13::(theatrical rating)', 'Nigeria:PG', 'Norway:15::(DVD and Blu-ray rating)', 'Norway:15::(cinema rating)', 'Norway:16::(cinema rating)', 'Peru:18', 'Philippines:R-18::(self-applied)', 'Poland:12', 'Portugal:M/12::(Qualidade)', 'Russia:14+', 'Russia:16+', 'Singapore:NC-16', 'South Africa:13', 'South Korea:15::(self-applied)', 'South Korea:18::(DVD rating)', 'Spain:13', 'Sweden:15', 'Sweden:15::(DVD and Blu-ray rating)', 'Taiwan:R-15', 'Thailand:u 18+::(self-applied)', 'Turkey:18+::(self-applied)', 'United Kingdom:15', 'United Kingdom:AA', 'United Kingdom:15::(video rating)', 'United States:R', 'United States:R', 'United States:R', 'Ukraine:16', 'United Arab Emirates:18+::(self-applied)', 'West Germany:16']",['Ridley Scott'],"['Action', 'Drama', 'Sci-Fi', 'Thriller']",https://m.media-amazon.com/images/M/MV5BNzQzMzJhZTEtOWM4NS00MTdhLTg0YjgtMjM4MDRkZjUwZDBlXkEyXkFqcGdeQXVyNjU0OTQ0OTY@.jpg,"In the early twenty-first century, the Tyrell Corporation, during what was called the Nexus phase, developed robots, called ""replicants"", that were supposed to aid society, the replicants which looked and acted like humans. When the superhuman generation Nexus 6 replicants, used for dangerous off-Earth endeavors, began a mutiny on an off-Earth colony, replicants became illegal on Earth. Police units, called ""blade runners"", have the job of destroying - or in their parlance ""retiring"" - any replicant that makes its way back to or created on Earth, with anyone convicted of aiding or assisting a replicant being sentenced to death. It's now November, 2019 in Los Angeles, California. Rick Deckard, a former blade runner, is called out of retirement when four known replicants, most combat models, have made their way back to Earth, with their leader being Roy Batty. One, Leon Kowalski, tried to infiltrate his way into the Tyrell Corporation as an employee, but has since been able to escape. Beyond following Leon's trail in hopes of finding and retiring them all, Deckard believes part of what will help him is figuring out what the replicants wanted with the Tyrell Corporation in trying to infiltrate it. The answer may lie with Tyrell's fail-safe backup mechanism. Beyond tracking the four, Deckard faces a possible dilemma in encountering a fifth replicant: Rachael, who works as Tyrell's assistant. The issue is that Dr. Elden Tyrell is experimenting with her, to provide her with fake memories so as to be able to better control her. With those memories, Rachael has no idea that she is not human. The problem is not only Rachael's assistance to Deckard, but that he is beginning to develop feelings for her.",8.1,['117'],Blade Runner,799338,1982,55
"['Mel Gibson', 'Danny Glover', 'Gary Busey', 'Mitchell Ryan']","['Argentina:16', 'Australia:M', 'Belgium:14', 'Brazil:14::(DVD rating)', 'Brazil:18', 'Brazil:16', 'Canada:18A::(British Columbia)', 'Canada:R::(Manitoba/Nova Scotia)', 'Canada:R::(Ontario)', 'Canada:13+::(Quebec)', 'Canada:18+::(Quebec)', 'Canada:13+::(Quebec)', 'Canada:AA::(Ontario)', 'Czechia:15', 'Denmark:15', 'Ecuador:TP::(self-applied)', 'Finland:K-16', 'Finland:K-16', 'Finland:K-16', 'Finland:K-18', 'France:12::(new rating)', 'France:13', 'Germany:16', 'Germany:12', 'Germany:16', 'Hong Kong:II', 'Hong Kong:IIB', 'Hungary:16', 'Iceland:16', 'India:UA::(TV)', 'India:A::(Bombay)', 'Ireland:16', 'Ireland:18::(video rating)', 'Ireland:16::(theatrical rating)', 'Italy:VM14', 'Italy:T::(Google Play)', 'Japan:PG-12', 'Mexico:C', 'Netherlands:12', 'Netherlands:16', 'Netherlands:12', 'New Zealand:M', 'New Zealand:R13::(theatrical rating)', 'Norway:16::(Netflix self-rating)', 'Norway:15::(VOD)', 'Norway:18::(cinema rating)', 'Peru:18', 'Philippines:R-18', 'Philippines:PG-13::(theatrical rating)', 'Poland:16::(self-applied)', 'Portugal:M/12', 'Russia:18+', 'Singapore:NC-16', 'South Africa:16', 'South Korea:15', 'South Korea:18', 'Spain:12::(ICAA)', 'Spain:13::(ICAA)', 'Sweden:15', 'Sweden:15', 'Sweden:15', 'United Kingdom:15', 'United Kingdom:18', 'United Kingdom:15', 'United States:TV-14', 'United States:TV-MA::(DLV)', 'United States:TV-MA::(DLV)', 'United States:TV-MA::(DLV)', 'United States:TV-14::(LV, TV Rating.)', 'United States:TV-MA::(cable rating)', 'United States:R', 'United States:Unrated', 'United Arab Emirates:Not Rated', 'West Germany:18', 'West Germany:16::(nf)']",['Richard Donner'],"['Action', 'Crime', 'Thriller']",https://m.media-amazon.com/images/M/MV5BZTllNWNlZjctMWQwMS00ZDc3LTg5ZjMtNzhmNzhjMmVhYTFlXkEyXkFqcGdeQXVyNTc1NTQxODI@.jpg,"Martin Riggs is an L.A. cop with suicidal tendencies and Roger Murtaugh is the unlucky police officer with whom Riggs is assigned. Together they uncover a huge drug-smuggling operation, and as their success rate grows so does their friendship.",7.6,['109'],Lethal Weapon,269459,1987,56
"['Mike Myers', 'Heather Graham', 'Michael York', 'Robert Wagner']","['Argentina:13', 'Australia:M', 'Austria:12', 'Brazil:12::(video rating)', 'Canada:PG', 'Canada:G::(Quebec)', 'Denmark:11', 'Finland:K-12', 'France:Tous publics', 'Germany:12', 'Greece:K-12', 'Hong Kong:IIB', 'Hungary:12', 'Iceland:12', 'India:UA', 'India:A::(cinema rating)', 'Ireland:15::(DVD rating)', 'Ireland:12RA::(DVD rating)', 'Ireland:12', 'Israel:14::(self-applied)', 'Italy:T', 'Malaysia:(Banned)', 'Netherlands:6', 'New Zealand:M', 'Norway:11::(cinema rating)', 'Peru:14', 'Philippines:PG-13', 'Poland:12::(self-applied)', 'Portugal:M/12', 'Russia:18+', 'Singapore:PG', 'Singapore:PG13', 'South Africa:10', 'South Korea:18', 'Spain:13', 'Sweden:7', 'Switzerland:12::(canton of Geneva)', 'Switzerland:12::(canton of Vaud)', 'United Kingdom:12', 'United States:TV-14::(DLSV)', 'United States:TV-MA::(L)', 'United States:PG-13']",['Jay Roach'],"['Action', 'Adventure', 'Comedy', 'Crime']",https://m.media-amazon.com/images/M/MV5BMmFkZGQxN2YtODNlYS00MzM5LTk3NjQtNTUxYmQ1YzkwMDhmXkEyXkFqcGdeQXVyMTQxNzMzNDI@.jpg,"Thirsting for revenge after the events of Austin Powers: International Man of Mystery (1997), despicable Dr Evil gets his hands on a diabolical machine and travels back to groovy 1969. But everyone knows that bad habits are hard to break, and this time, apart from world domination, the ambitious megalomaniac is bent on stealing everything Austin holds dear: his undeniable charm and swagger and his vaulting libido. As an insecure Powers returns to the psychedelic 1960s, teamed up with blonde CIA bombshell Felicity Shagwell, the out-of-time British agent must do the impossible: salvage what's left of his once-unstoppable sex drive and thwart Dr Evil's latest lunatic plot. Can Austin Powers, the man who lost his mojo, avert the inevitable for the second time?",6.6,['95'],Austin Powers: The Spy Who Shagged Me,243026,1999,57
"['Dee Wallace', 'Henry Thomas', 'Peter Coyote', 'Robert MacNaughton']","['Argentina:Atp', 'Australia:G', 'Australia:PG', 'Brazil:Livre', 'Canada:G::(British Columbia)', 'Canada:PG::(Manitoba)', 'Canada:G::(Nova Scotia)', 'Canada:PG::(Ontario)', 'Canada:G::(Québec)', 'Canada:G::(Saskatchewan)', 'Canada:PG::(Alberta)', 'Canada:PG::(Nova Scotia)', 'Canada:F::(Ontario)', 'Chile:TE', 'Colombia:T', 'Czechia:U', 'Denmark:7::(Blu-ray rating)', 'Egypt:G::(self-applied)', 'Finland:K-8', 'Finland:K-7::(Blu-ray rating)', 'Finland:(Banned)', 'France:Tous publics', 'Germany:6', 'Hong Kong:I', 'Hungary:KN', 'Iceland:LH', 'India:U', 'Ireland:G', 'Israel:ALL', 'Italy:T', 'Japan:G', 'Lithuania:V', 'Malaysia:U', 'Mexico:AA', 'Netherlands:6::(20th anniversary edition)', 'Netherlands:AL', 'New Zealand:G', 'Nigeria:G', 'Norway:7::(20th anniversary special edition)', 'Norway:9', 'Norway:12', 'Peru:14', 'Philippines:G', 'Poland:7::(self-applied)', 'Portugal:M/6', 'Russia:0+', 'Saudi Arabia:G', 'Singapore:G::(20th anniversary edition)', 'Singapore:PG', 'South Africa:PG', 'South Korea:All', 'Soviet Union:(Banned)', 'Spain:A', 'Sweden:11', 'Sweden:Btl::(Viaplay self-rating)', 'Sweden:7', 'Switzerland:7::(canton of Geneva)', 'Switzerland:7::(canton of Vaud)', 'Switzerland:8::(canton of the Grisons)', 'Taiwan:GP', 'Thailand:G', 'Turkey:G', 'United Kingdom:U', 'United States:TV-PG', 'United States:PG', 'United States:PG::(20th anniversary edition)', 'Ukraine:ZA', 'United Arab Emirates:PG-13::(self-applied)', 'Vietnam:P', 'West Germany:6']",['Steven Spielberg'],"['Adventure', 'Family', 'Sci-Fi']",https://m.media-amazon.com/images/M/MV5BMTQ2ODFlMDAtNzdhOC00ZDYzLWE3YTMtNDU4ZGFmZmJmYTczXkEyXkFqcGdeQXVyMTQxNzMzNDI@.jpg,"After a gentle alien becomes stranded on Earth, he is discovered and befriended by a 10-year-old boy named Elliott. Bringing him into his suburban California house, Elliott introduces E.T., as he is dubbed, to his brother, Michael, and sister, Gertie, and they decide to keep his existence a secret. Soon, however, he falls ill, resulting in government intervention and a dire situation for both him and Elliott.",7.9,['115'],E.T. the Extra-Terrestrial,425851,1982,58
"['Mike Myers', 'Elizabeth Hurley', 'Michael York', 'Mimi Rogers']","['Argentina:13', 'Australia:M', 'Brazil:12', 'Canada:PG-13', 'Canada:PG::(Alberta/Manitoba/Ontario)', 'Canada:14::(Nova Scotia)', 'Canada:G::(Quebec)', 'Chile:18', 'Czechia:12', 'Denmark:11', 'Finland:K-12', 'France:Tous publics', 'Germany:12', 'Greece:K-12', 'Iceland:L', 'India:UA', 'India:U', 'India:A::(theatrical)', 'Ireland:15', 'Italy:T', 'Malaysia:18SX', 'Netherlands:6', 'Netherlands:12::(VHS/DVD rating)', 'New Zealand:M', 'Norway:11::(cinema rating)', 'Poland:12', 'Portugal:M/12', 'Russia:16+', 'Singapore:PG', 'Singapore:NC-16', 'South Africa:10', 'South Korea:18', 'Spain:13', 'Sweden:11', 'United Kingdom:15', 'United Kingdom:12', 'United States:TV-14::(DLSV)', 'United States:TV-14::(DS)', 'United States:PG-13']",['Jay Roach'],"['Adventure', 'Comedy']",https://m.media-amazon.com/images/M/MV5BMTRhZTY0MDItY2I1Yi00MGE3LTk1ZDEtMjA0ZGZhNDQyNGU0XkEyXkFqcGdeQXVyNTIzOTk5ODM@.jpg,"Austin Powers is a 60's spy who is cryogenically frozen and released in the 1990's. The world is a very different place for Powers. Unfortunately for Austin, everyone is no longer sex-mad. Although he may be in a different decade, his mission is still the same. He has teamed up with Vanessa Kensington to stop the evil Dr. Evil, who was also frozen in the past. Dr. Evil stole a nuclear weapon and is demanding a payment of (when he realizes its the 90's) 100 billion dollars. Can Austin Powers stop this madman? or will he caught up with Evil's henchman, with names like Alotta Fagina and Random Task? Only time will tell.",7,['94'],Austin Powers: International Man of Mystery,250884,1997,59
"['Don Rickles', 'Dean Martin', 'Bob Hope', 'Orson Welles']",[],['Greg Garrison'],['Comedy'],https://m.media-amazon.com/images/M/MV5BN2FmZDc3YTUtMWFjNi00YTJjLTkyMTgtYzA0MDIxYjI4ZGJmXkEyXkFqcGdeQXVyMjcyMDU4NA@@.jpg,No outline available.,8.7,['101'],Dean Martin Celebrity Roast: Dean Martin,224,1976,60
"['Heather Donahue', 'Joshua Leonard', 'Michael C. Williams', 'Bob Griffin']","['Argentina:13', 'Australia:M15+::(VHS)', 'Australia:MA', 'Australia:M', 'Belgium:KNT/ENA', 'Brazil:12', 'Canada:14A', 'Canada:14A::(Alberta/British Columbia)', 'Canada:PA::(Manitoba)', 'Canada:14::(Nova Scotia)', 'Canada:AA::(Ontario)', 'Canada:13+::(Quebec)', 'Denmark:15', 'Ecuador:15::(self-applied)', 'Finland:K-16', 'France:12', 'Germany:12', 'Hong Kong:IIB', 'Hungary:16', 'Iceland:12', 'India:UA', 'Indonesia:17+::(self-applied)', 'Israel:16::(self-applied)', 'Italy:T', 'Japan:Unrated', 'Malaysia:18PL', 'Mexico:B', 'Netherlands:16', 'New Zealand:R13', 'Norway:15::(cinema rating)', 'Peru:14', 'Philippines:PG-13::(MTRCB)', 'Philippines:SPG::(TV rating)', 'Poland:16', 'Portugal:M/12', 'Russia:16+', 'Singapore:PG', 'Singapore:NC-16', 'South Korea:18', 'Spain:13::(ICAA)', 'Sweden:15', 'Switzerland:16::(canton of Geneva)', 'Switzerland:16::(canton of Vaud)', 'Turkey:15+', 'United Kingdom:15', 'United States:R', 'United Arab Emirates:16+::(DVD rating)']","['Daniel Myrick', 'Eduardo Sánchez']","['Horror', 'Mystery']",https://m.media-amazon.com/images/M/MV5BNzQ1NDBlNDItMDAyYS00YTI2LTgwMmYtMzAwMzg4NDFlM2ZmXkEyXkFqcGdeQXVyMTQxNzMzNDI@.jpg,"In search of a local legend, three bold amateur documentarians--director, Heather; cameraman, Josh; sound recorder, Mike--hike into Burkittsville's gloomy Black Hills Forest to find a shadow: the fabled Blair Witch. Now, one long year later--after that fateful October of 1994--there's still no sign of the student filmmakers, apart from the raw footage they left behind. Who knows what truly happened during their creepy five-day journey into the mouth of madness? Was there, indeed, an intangible supernatural presence in the dark woods that led to the team's disappearance? Either way, the missing trio must have seen something. Could the nightmarish myth be real?",6.5,['81'],The Blair Witch Project,274859,1999,61
"['Daniel Day-Lewis', 'Madeleine Stowe', 'Russell Means', 'Eric Schweig']","['Argentina:13', 'Australia:M', 'Brazil:12', 'Canada:14A::(British Columbia)', 'Canada:PG::(Manitoba/Ontario)', 'Canada:14::(Nova Scotia)', 'Canada:13+::(Quebec)', 'Denmark:15::(TV rating)', 'Finland:K-16', 'Finland:K-14', 'France:Tous publics', 'Germany:16', 'Hong Kong:II', 'Hungary:12', 'Iceland:16', 'India:UA', 'India:A::(theatrical rating)', 'Ireland:15', 'Ireland:15::(DVD rating)', 'Italy:T', 'Japan:G', 'Malaysia:U', 'Mexico:B::(DVD rating)', 'Netherlands:16', 'New Zealand:PG', 'Norway:15::(cinema rating)', 'Peru:14', 'Poland:16', 'Portugal:M/12', 'Singapore:PG', 'Singapore:PG13::(Netflix)', 'Singapore:PG13', 'South Africa:13', 'South Korea:15', 'South Korea:12', 'Spain:13', 'Sweden:15', 'Sweden:11', 'Taiwan:16+::(self-applied)', 'Thailand:16+::(self-applied)', 'Turkey:18+::(self-applied)', 'United Kingdom:12', 'United Kingdom:15::(video rating)', 'United Kingdom:12::(DVD rating)', 'United Kingdom:15::(video rating)', 'United States:R', 'United States:PG-13', 'United States:Unrated', 'United Arab Emirates:12::(DVD rating)']",['Michael Mann'],"['Action', 'Adventure', 'Drama', 'Romance', 'War']",https://m.media-amazon.com/images/M/MV5BZDNiYmRkNDYtOWU1NC00NmMxLWFkNmUtMGI5NTJjOTJmYTM5XkEyXkFqcGdeQXVyNzQ1ODk3MTQ@.jpg,"The last members of a dying Native American tribe, the Mohicans -- Uncas, his father Chingachgook, and his adopted half-white brother Hawkeye -- live in peace alongside British colonists. But when the daughters of a British colonel are kidnapped by a traitorous scout, Hawkeye and Uncas must rescue them in the crossfire of a gruesome military conflict of which they wanted no part: the French and Indian War.",7.7,['112'],The Last of the Mohicans,180445,1992,62
"['Denzel Washington', 'Angelina Jolie', 'Queen Latifah', 'Michael Rooker']","['Argentina:16', 'Argentina:18::(cable rating)', 'Australia:M', 'Brazil:14', 'Brazil:18::(DVD rating)', 'Brazil:18::(TV rating)', 'Canada:18A::(Alberta)', 'Canada:14A::(British Columbia)', 'Canada:R::(Manitoba/Ontario)', 'Canada:14::(Nova Scotia)', 'Canada:16+::(Quebec)', 'Canada:13+::(Québec)', 'Chile:14', 'Denmark:15', 'Ecuador:16::(self-applied)', 'Finland:K-16', 'Finland:K-15/13', 'Finland:K-16/13', 'France:12', 'Germany:16', 'Hong Kong:IIB', 'Iceland:16', 'India:UA::(TV rating)', 'India:A', 'Ireland:15', 'Italy:T', 'Japan:PG-12', 'Malaysia:18SG', 'Netherlands:16', 'New Zealand:M', 'Norway:15::(VOD)', 'Norway:15::(recommended rating)', 'Norway:18::(cinema rating)', 'Peru:14', 'Philippines:R-18', 'Poland:16', 'Portugal:M/16', 'Singapore:PG', 'Singapore:PG13', 'South Korea:18', 'Spain:18::(ICAA)', 'Sweden:15', 'Switzerland:16::(canton of Geneva)', 'Switzerland:16::(canton of Vaud)', 'Turkey:G::(self-applied)', 'United Kingdom:15', 'United States:TV-14::(DLV)', 'United States:R', 'Ukraine:16', 'United Arab Emirates:18+::(self-applied)']",['Phillip Noyce'],"['Crime', 'Drama', 'Mystery', 'Thriller']",https://m.media-amazon.com/images/M/MV5BMzMyMDYxZGItYzZmNi00YmI0LTljMzQtYzMzOTY2NmQ1ZGNkXkEyXkFqcGdeQXVyMjUzOTY1NTc@.jpg,"Quadriplegic ex-cop Lincoln Rhyme was looking forward to his assisted suicide when he got the news: some sicko was abducting people in a taxi and leaving them to die in particularly sadistic ways. With time counting down between each abduction and possible death, Rhyme recruits rather-unwilling Amelia Donaghy, haunted by her cop father's suicide and thinking she's next, into working the crime scenes to track down the killer.",6.7,['118'],The Bone Collector,179146,1999,63
"['Michael Douglas', 'Kathleen Turner', 'Danny DeVito', 'Spyros Fokas']","['Argentina:Atp', 'Australia:PG', 'Brazil:Livre', 'Bulgaria:B', 'Canada:G::(Québec)', 'Chile:TE', 'Czechia:U', 'Finland:K-12', 'France:Tous publics', 'Greece:K-8', 'Hong Kong:I', 'Iceland:10', 'India:U', 'Ireland:PG', 'Italy:T', 'Japan:G', 'Malaysia:U', 'Netherlands:6', 'Norway:7::(TV rating)', 'Norway:12::(cinema rating)', 'Poland:12::(TV rating)', 'Portugal:M/6', 'Singapore:PG', 'South Africa:A', 'South Korea:15::(video rating)', 'South Korea:12::(theatrical rating)', 'Sweden:15', 'United Kingdom:PG', 'United States:PG', 'West Germany:12']",['Lewis Teague'],"['Action', 'Adventure', 'Comedy', 'Romance']",https://m.media-amazon.com/images/M/MV5BOWI5ZDYyZGUtNjBjZS00OWZmLTg2YjYtMzZhMjg3NjQ5MzVlXkEyXkFqcGdeQXVyNjc5NjEzNA@@.jpg,"This is the sequel to ""Romancing the Stone"" where Jack and Joan have their yacht and easy life, but are gradually getting bored with each other and this way of life. Joan accepts an invitation to go to some middle eastern country as a guest of the sheik, but there she is abducted and finds her- self involved with the ""jewel"". Jack decides to rescue her with his new partner Ralph. They all go from one adventure to another... What is the story of this ""jewel""?",6.1,['106'],The Jewel of the Nile,60709,1985,64
['Jack Mercer'],"['Brazil:Livre', 'United States:TV-G']",[],"['Animation', 'Comedy', 'Family', 'Fantasy', 'Sci-Fi']",https://m.media-amazon.com/images/M/MV5BZDg4YzE3OWEtZGU0OS00ZGZhLTkyNjgtNWFmMmNhNjZkMTAzXkEyXkFqcGdeQXVyNzMwOTY2NTI@.jpg,No outline available.,6.6,['30'],Felix the Cat,902,1958,66
"['Julia Roberts', 'David Brisbin', 'Dawn Didawick', 'Albert Finney']","['Argentina:13', 'Australia:M', 'Austria:10', 'Brazil:14', 'Canada:14A', 'Denmark:A', 'Finland:S', 'France:Tous publics', 'Germany:6', 'Hong Kong:IIB', 'Iceland:L', 'India:UA', 'India:A', 'Ireland:15', 'Israel:15+::(self-applied)', 'Italy:T', 'Japan:G', 'Malaysia:U', 'Mexico:B15', 'Netherlands:AL', 'New Zealand:M', 'Norway:A::(cinema rating)', 'Peru:14', 'Philippines:G', 'Poland:16', 'Portugal:M/12', 'Russia:16+', 'Singapore:PG', 'Singapore:PG13', 'South Africa:13', 'South Korea:15', 'Spain:A::(ICAA)', 'Sweden:Btl', 'Switzerland:7::(canton of Geneva)', 'Switzerland:7::(canton of Vaud)', 'United Kingdom:15', 'United States:TV-PG', 'United States:R', 'United Arab Emirates:16+::(self-applied)']",['Steven Soderbergh'],"['Biography', 'Drama']",https://m.media-amazon.com/images/M/MV5BYTA1NWRkNTktNDMxNS00NjE4LWEzMDAtNzA3YzlhYzRhNDA4L2ltYWdlXkEyXkFqcGdeQXVyMTQxNzMzNDI@.jpg,"Erin Brockovich-Ellis is an unemployed single mother, desperate to find a job, but is having no luck. This losing streak even extends to a failed lawsuit against a doctor in a car accident she was in. With no alternative, she successfully browbeats her lawyer to give her a job in compensation for the loss. While no one takes her seriously, with her trashy clothes and earthy manners, that soon changes when she begins to investigate a suspicious real estate case involving the Pacific Gas & Electric Company. What she discovers is that the company is trying quietly to buy land that was contaminated by hexavalent chromium, a deadly toxic waste that the company is improperly and illegally dumping and, in turn, poisoning the residents in the area. As she digs deeper, Erin finds herself leading point in a series of events that would involve her law firm in one of the biggest class action lawsuits in American history against a multi-billion dollar corporation.",7.4,['131'],Erin Brockovich,211090,2000,67
"['Tom Cruise', 'Jon Voight', 'Emmanuelle Béart', 'Henry Czerny']","['Argentina:Atp', 'Australia:M', 'Brazil:Livre', 'Brazil:12', 'Canada:PG::(British Columbia)', 'Canada:14::(Nova Scotia)', 'Canada:G::(Quebec)', 'Czechia:12', 'Denmark:15', 'Egypt:18TC', 'Finland:K-12', 'France:Tous publics', 'Germany:12::(bw)', 'Hong Kong:IIB', 'Iceland:12', 'India:U', 'Indonesia:16+::(self-applied)', 'Ireland:12RA::(VHS)', 'Ireland:PG::(DVD)', 'Israel:13::(self-applied)', 'Italy:T', 'Japan:G', 'Malaysia:18SG', 'Mexico:A', 'Netherlands:12', 'New Zealand:M', 'Norway:15', 'Peru:Apt', 'Philippines:PG', 'Philippines:PG::(self-applied)', 'Poland:12::(self-applied)', 'Portugal:M/12', 'Russia:12+', 'Singapore:PG', 'Singapore:PG13', 'South Africa:PG', 'South Korea:15', 'Spain:13', 'Spain:16::(TV rating)', 'Sweden:11', 'Taiwan:P::(self-applied)', 'Thailand:u 13+::(self-applied)', 'Turkey:16+::(self-applied)', 'United Kingdom:PG', 'United Kingdom:15::(Blu-ray)', 'United States:PG-13', 'United Arab Emirates:PG-15::(self-applied)']",['Brian De Palma'],"['Action', 'Adventure', 'Thriller']",https://m.media-amazon.com/images/M/MV5BMTc3NjI2MjU0Nl5BMl5BanBnXkFtZTgwNDk3ODYxMTE@.jpg,"Based on the hit television series. Jim Phelps (Jon Voight) was sent to Prague for a mission to prevent the theft of classified material. His wife Claire (Emmanuelle Béart) and his trusted partner Ethan Hunt (Tom Cruise) were members of Phelps' team. Unfortunately, something went horribly wrong and the mission failed, leaving Ethan Hunt the seemingly lone survivor. After he reported the failed mission, Kittridge (Henry Czerny), the head of the agency, suspects Ethan of being the culprit for the failed mission. Now, Ethan uses unorthodox methods (which includes the aid of an arms dealer going by the name ""Max"" (Vanessa Redgrave)) to try to find who set him up and to clear his name.",7.1,['110'],Mission: Impossible,456658,1996,68
"['Charles McGraw', 'Marcel Dalio', 'Dan Seymour', 'Michael Fox']",[],[],['Drama'],https://m.media-amazon.com/images/M/MV5BNzg0MzYxNDQtMTM4MS00MTBmLWJhODEtMGY3ZmMxYmNhMDI3XkEyXkFqcGdeQXVyNjgyNTk4NTY@.jpg,No outline available.,6.3,['60'],Casablanca,71,1955,70
"['Adam Sandler', 'Christopher McDonald', 'Julie Bowen', 'Frances Bay']","['Argentina:13', 'Australia:M', 'Brazil:14', 'Canada:PG::(British Columbia/Manitoba/Ontario)', 'Canada:14::(Nova Scotia)', 'Ecuador:12::(self-applied)', 'Finland:K-12::(video premiere)', 'France:13::(self-applied)', 'Germany:6', 'Iceland:L', 'Ireland:15', 'Israel:14::(self-applied)', 'Italy:T', 'Mexico:PG-13::(Blu-ray rating)', 'Netherlands:MG6::(video premiere)', 'Norway:11', 'Philippines:PG-13', 'Poland:12::(TV rating)', 'Singapore:PG', 'South Korea:12', 'Spain:A', 'Sweden:11', 'United Kingdom:12', 'United States:TV-PG::(DLSV)', 'United States:TV-14::(DLV, TV Rating.)', 'United States:PG-13']",['Dennis Dugan'],"['Comedy', 'Sport']",https://m.media-amazon.com/images/M/MV5BZWI2NjliOTYtZjE1OS00YzAyLWJjYTQtYWNmZTQzMTQzNzVjXkEyXkFqcGdeQXVyMTQxNzMzNDI@.jpg,A Hockey player wannabe finds out that he has the most powerful golf drive in history. He joins the P.G.A. tour to make some money to save grandma's house. The downside is that his hockey player mentality doesn't really go on the P.G.A. tour. Especially with the favorite to win the championship.,7,['92'],Happy Gilmore,239527,1996,71
