cast,certificates,director,genres,image,plot outline,rating,runtime,title,votes,year,id
"['Harrison Ford', 'Karen Allen', 'Paul Freeman', 'Ronald Lacey']","['Argentina:13', 'Australia:M', 'Australia:NRC', 'Australia:M', 'Australia:PG', 'Brazil:Livre', 'Brazil:14', 'Brazil:Livre::(1993 - TV)', 'Bulgaria:B', 'Canada:PG::(Alberta / Ontario)', 'Canada:14A::(Canadian Home Video rating)', 'Canada:PA::(Manitoba)', 'Canada:14::(Nova Scotia)', 'Canada:13+::(Quebec)', 'Canada:R::(Saskatchewan)', 'Canada:G::(Quebec)', 'Chile:14', 'Colombia:12', 'Czechia:U', 'Denmark:15', 'Egypt:12+', 'Finland:K-12', 'Finland:K-11', 'Finland:K-16', 'France:Tous publics', 'Germany:12', 'Greece:K-8', 'Hong Kong:II', 'Hong Kong:IIA', 'Hungary:12', 'Iceland:12', 'India:UA', 'India:U::(recommended rating)', 'India:A', 'Ireland:PG', 'Israel:PG', 'Italy:T', 'Japan:G', 'Malaysia:U', 'Maldives:12+', 'Malta:PG', 'Mexico:A', 'Netherlands:12::(DVD rating)', 'New Zealand:PG', 'Nigeria:G', 'Norway:15::(DVD and Blu-ray rating)', 'Norway:7::(Streaming rating)', 'Norway:16::(cinema rating)', 'Peru:14', 'Philippines:G', 'Poland:12::(self-applied)', 'Portugal:M/12', 'Russia:0+', 'Saudi Arabia:G', 'Singapore:PG', 'South Africa:13::(self-applied)', 'South Korea:12', 'Spain:A', 'Sweden:15', 'Sweden:7+::(Digital Streaming)', 'Sweden:12::(Disney+ rating)', 'Sweden:15', 'Taiwan:U::(self-applied)', 'Thailand:u 15+::(self-applied)', 'Turkey:16+::(self-applied)', 'United Kingdom:12A', 'United Kingdom:A', 'United Kingdom:12A::(cinema rating)', 'United Kingdom:PG', 'United States:TV-14::(DLSV, TV rating)', 'United States:TV-PG::(TV rating)', 'United States:PG', 'United Arab Emirates:16+::(self-applied)', 'West Germany:16']",['Steven Spielberg'],"['Action', 'Adventure']",https://m.media-amazon.com/images/M/MV5BNTU2ODkyY2MtMjU1NC00NjE1LWEzYjgtMWQ3MzRhMTE0NDc0XkEyXkFqcGdeQXVyMjM4MzQ4OTQ@.jpg,"The year is 1936. An archeology professor named Indiana Jones is venturing in the jungles of South America searching for a golden statue. Unfortunately, he sets off a deadly trap but miraculously escapes. Then, Jones hears from a museum curator named Marcus Brody about a biblical artifact called The Ark of the Covenant, which can hold the key to human existence. Jones has to venture to vast places such as Nepal and Egypt to find this artifact. However, he will have to fight his enemy Rene Belloq and a band of Nazis in order to reach it.",8.4,['115'],Indiana Jones and the Raiders of the Lost Ark,1011739,1981,88
"['Harrison Ford', 'Sean Connery', 'Denholm Elliott', 'Alison Doody']","['Argentina:13', 'Australia:PG', 'Brazil:Livre::(1991, cinema and TV)', 'Brazil:Livre', 'Brazil:14', 'Canada:PG::(Manitoba/Ontario)', 'Canada:14::(Nova Scotia)', 'Canada:G::(Quebec)', 'Chile:14', 'Colombia:12', 'Denmark:11::(DVD rating)', 'Egypt:Not Rated::(self-applied)', 'Finland:K-14', 'Finland:K-16/13', 'Finland:K-12::(DVD and Bluray rating)', 'France:Tous publics', 'Germany:12', 'Greece:K-8', 'Hong Kong:II', 'Hong Kong:IIA', 'Hungary:12', 'Iceland:12', 'India:U', 'Ireland:PG', 'Israel:PG', 'Italy:T', 'Japan:G', 'Malaysia:U', 'Mexico:A', 'Netherlands:AL', 'Netherlands:12::(DVD rating)', 'New Zealand:PG', 'Nigeria:G', 'Norway:12::(Netflix self-rating)', 'Norway:15::(cinema rating)', 'Peru:Apt', 'Philippines:PG-13', 'Poland:12::(self-applied)', 'Portugal:M/12', 'Russia:0+', 'Saudi Arabia:G', 'Singapore:PG', 'South Africa:PG', 'South Korea:15', 'South Korea:12', 'South Korea:All::(theatrical rating)', 'Spain:A', 'Sweden:15', 'Thailand:u 15+::(self-applied)', 'Turkey:13+::(self-applied)', 'United Kingdom:PG', 'United Kingdom:12A::(cinema rating)', 'United States:PG-13', 'United Arab Emirates:PG-15::(self-applied)']",['Steven Spielberg'],"['Action', 'Adventure']",https://m.media-amazon.com/images/M/MV5BY2Q0ODg4ZmItNDZiYi00ZWY5LTg2NzctNmYwZjA5OThmNzE1XkEyXkFqcGdeQXVyMjM4MzQ4OTQ@.jpg,"An art collector appeals to Indiana Jones to embark on a search for the Holy Grail. He learns that another archaeologist has disappeared while searching for the precious goblet, and the missing man is his own father, Dr. Henry Jones. The artifact is much harder to find than they expected, and its powers are too much for those impure of heart.",8.2,['127'],Indiana Jones and the Last Crusade,790622,1989,89
"['Harrison Ford', 'Kate Capshaw', 'Ke Huy Quan', 'Amrish Puri']","['Argentina:13', 'Australia:NRC', 'Australia:M', 'Australia:PG', 'Brazil:Livre', 'Brazil:14', 'Brazil:Livre::(video)', 'Brazil:14::(1991 - TV)', 'Canada:PG::(Canadian Home Video rating)', 'Canada:PG::(Manitoba/Ontario)', 'Canada:14::(Nova Scotia)', 'Canada:13+::(Quebec)', 'Canada:G::(Quebec)', 'Chile:14', 'Colombia:12', 'Denmark:11', 'Ecuador:12::(self-applied)', 'Egypt:G::(self-applied)', 'Finland:K-16', 'Finland:K-12', 'France:Tous publics', 'Germany:12', 'Germany:12', 'Greece:K-8', 'Hong Kong:IIA', 'Hungary:12', 'Iceland:10', 'Iceland:12::(video rating)', 'India:UA', 'India:(Banned)', 'Ireland:PG', 'Israel:PG', 'Italy:T', 'Japan:G', 'Malaysia:U', 'Mexico:A', 'Netherlands:12::(DVD rating)', 'New Zealand:PG', 'Nigeria:PG', 'Norway:15::(DVD and Blu-ray rating)', 'Norway:12::(VOD)', 'Norway:16::(cinema rating)', 'Peru:Apt', 'Poland:12', 'Portugal:M/12', 'Portugal:M/6', 'Russia:0+', 'Saudi Arabia:PG', 'Singapore:PG', 'South Africa:PG', 'South Africa:13::(self-applied)', 'South Korea:12', 'Spain:13', 'Spain:12::(Movistar+)', 'Sweden:15', 'Thailand:u 15+::(self-applied)', 'Turkey:7+::(self-applied)', 'United Kingdom:12A', 'United Kingdom:12::(DVD rating)', 'United Kingdom:PG', 'United Kingdom:12A', 'United States:PG', 'United Arab Emirates:PG::(self-applied)', 'West Germany:16']",['Steven Spielberg'],"['Action', 'Adventure']",https://m.media-amazon.com/images/M/MV5BYzgzMTIzNzctNmNiZC00ZDYyLWJjNzktMmQ2MDM2ZDkwZGVhXkEyXkFqcGdeQXVyMjM4MzQ4OTQ@.jpg,"Indiana Jones teams up with a nightclub singer named Wilhelmina ""Willie"" Scott and a twelve-year-old Chinese boy named Short Round. They end up in a small distressed village in India, where the people believe that evil spirits have taken all their children away after a sacred precious stone was stolen. They also discover the great mysterious terror surrounding a booby-trapped temple known as the Temple of Doom. Thuggee is beginning to attempt to rise once more, believing that with the power of all five Sankara stones they can rule the world. It's all up to Indiana to put an end to the Thuggee campaign, rescue the lost children, win the girl and conquer the Temple of Doom.",7.5,['118'],Indiana Jones and the Temple of Doom,521578,1984,90
"['Sean Patrick Flanery', 'Ronny Coutteure', 'Adrian Edmondson', 'Jayne Ashbourne']",[],['Carl Schultz'],"['Action', 'Adventure']",https://m.media-amazon.com/images/M/MV5BOTg2MTc2NDAzOF5BMl5BanBnXkFtZTcwODExNDIyMQ@@.jpg,"This movie finds Henry ""Indiana"" Jones, Jr. (Sean Patrick Flanery) vagabonding around the South Pacific on a treasure hunt for a fabled lost diamond. The war in Europe ends, but a new adventure begins for Indy when a mysterious man's dying words, ""The eye of the peacock."" send him and Remy Baudouin (Ronny Coutteure) on a thrilling treasure hunt for one of Alexander the Great's most prized possessions. Pursued by a dangerous one-eyed man, Indiana follows the trail of the diamond from London to Alexandria to the South Seas, where he has a run-in with a murderous band of Chinese pirates. The shipboard battle that ensues is a spectacular display of swords, guns and flying fists. Marooned by the pirates on a remote desert island, Indiana is captured by savage headhunters, but before they can turn him into a shrunken head and cannibal stew, he is rescued by anthropologist Bronislaw Malinowski (Sir Tom Courtenay), and makes a life-altering decision.",6.6,['94'],The Adventures of Young Indiana Jones: Treasure of the Peacock's Eye,1032,1995,91
"['Rowan Atkinson', 'Matilda Ziegler', 'Robin Driscoll', 'Matthew Ashforde']","['Argentina:Atp', 'Australia:G', 'Australia:PG::(cable rating)', 'Brazil:10', 'Egypt:Not Rated::(DVD rating)', 'France:Tous publics', 'Germany:0', 'Germany:6::(few episodes)', 'India:U', 'Italy:T', 'Japan:G', 'Malaysia:P13', 'Netherlands:AL::(DVD rating)', 'Norway:A', 'Philippines:PG::(self-applied)', 'Poland:7::(self-applied)', 'Singapore:PG', 'South Africa:10-12PG::(self-applied)', 'Spain:A', 'Sweden:7::(self-applied)', 'United Kingdom:U::(video rating)', 'United States:Not Rated', 'United States:TV-G::(some episodes)', 'United States:TV-PG::(some episodes)']",[],"['Comedy', 'Family']",https://m.media-amazon.com/images/M/MV5BMGNhODY0ZjktYjY2ZS00MGNkLTg2ZTUtMGEwNGRlMmY3ZjQ4XkEyXkFqcGdeQXVyNTgyNTA4MjM@.jpg,"Mr Bean (portrayed by Sir Rowan Sebastian Atkinson) is a lazy, crazy, clumsy, mischievous and destructive lunatic alien man from outer space who has fallen to earth out of his UFO. join him on his adventures of solving problems and creating worse disasters in this hilarious slapstick science fiction comedy Television sitcom series for the entire family.",8.6,['25'],Mr. Bean Pink,127937,1990,92
"['Rowan Atkinson', 'Matilda Ziegler', 'Robin Driscoll', 'Matthew Ashforde']","['Argentina:Atp', 'Australia:G', 'Australia:PG::(cable rating)', 'Brazil:10', 'Egypt:Not Rated::(DVD rating)', 'France:Tous publics', 'Germany:0', 'Germany:6::(few episodes)', 'India:U', 'Italy:T', 'Japan:G', 'Malaysia:P13', 'Netherlands:AL::(DVD rating)', 'Norway:A', 'Philippines:PG::(self-applied)', 'Poland:7::(self-applied)', 'Singapore:PG', 'South Africa:10-12PG::(self-applied)', 'Spain:A', 'Sweden:7::(self-applied)', 'United Kingdom:U::(video rating)', 'United States:Not Rated', 'United States:TV-G::(some episodes)', 'United States:TV-PG::(some episodes)']",[],"['Comedy', 'Family']",https://m.media-amazon.com/images/M/MV5BMGNhODY0ZjktYjY2ZS00MGNkLTg2ZTUtMGEwNGRlMmY3ZjQ4XkEyXkFqcGdeQXVyNTgyNTA4MjM@.jpg,"Mr Bean (portrayed by Sir Rowan Sebastian Atkinson) is a lazy, crazy, clumsy, mischievous and destructive lunatic alien man from outer space who has fallen to earth out of his UFO. join him on his adventures of solving problems and creating worse disasters in this hilarious slapstick science fiction comedy Television sitcom series for the entire family.",8.6,['25'],Mr. Bean Orange,127937,1990,93
"['Rowan Atkinson', 'Matilda Ziegler', 'Robin Driscoll', 'Matthew Ashforde']","['Argentina:Atp', 'Australia:G', 'Australia:PG::(cable rating)', 'Brazil:10', 'Egypt:Not Rated::(DVD rating)', 'France:Tous publics', 'Germany:0', 'Germany:6::(few episodes)', 'India:U', 'Italy:T', 'Japan:G', 'Malaysia:P13', 'Netherlands:AL::(DVD rating)', 'Norway:A', 'Philippines:PG::(self-applied)', 'Poland:7::(self-applied)', 'Singapore:PG', 'South Africa:10-12PG::(self-applied)', 'Spain:A', 'Sweden:7::(self-applied)', 'United Kingdom:U::(video rating)', 'United States:Not Rated', 'United States:TV-G::(some episodes)', 'United States:TV-PG::(some episodes)']",[],"['Comedy', 'Family']",https://m.media-amazon.com/images/M/MV5BMGNhODY0ZjktYjY2ZS00MGNkLTg2ZTUtMGEwNGRlMmY3ZjQ4XkEyXkFqcGdeQXVyNTgyNTA4MjM@.jpg,"Mr Bean (portrayed by Sir Rowan Sebastian Atkinson) is a lazy, crazy, clumsy, mischievous and destructive lunatic alien man from outer space who has fallen to earth out of his UFO. join him on his adventures of solving problems and creating worse disasters in this hilarious slapstick science fiction comedy Television sitcom series for the entire family.",8.6,['25'],Mr. Bean Blue,127937,1990,94
"['John Goodman', 'Elizabeth Perkins', 'Rick Moranis', ""Rosie O'Donnell""]","['Argentina:Atp', 'Australia:G', 'Brazil:Livre', 'Canada:G::(Manitoba/Nova Scotia/Québec)', 'Canada:PG::(Ontario)', 'Denmark:7', 'Finland:S', 'France:Tous publics', 'Germany:0::(w)', 'Iceland:L', 'India:U', 'Indonesia:7+::(self-applied)', 'Israel:ALL::(self-applied)', 'Italy:T', 'Japan:G', 'Malaysia:U', 'Mexico:A', 'Netherlands:6', 'Netherlands:AL', 'Norway:5', 'Peru:Apt', 'Poland:0::(self-applied)', 'Portugal:M/6', 'Russia:0+', 'Singapore:PG', 'South Korea:12::(Netflix)', 'South Korea:All::(DVD rating)', 'South Korea:12::(theatrical rating)', 'Spain:T', 'Sweden:7', 'Taiwan:12+::(self-applied)', 'Turkey:7+::(self-applied)', 'United Kingdom:U', 'United States:PG']",['Brian Levant'],"['Comedy', 'Family', 'Fantasy']",https://m.media-amazon.com/images/M/MV5BYzY0ZTk4YzctNzYzNy00ZDQ0LTg2Y2ItZTQyYzQxMjQwMDc2XkEyXkFqcGdeQXVyNTAyODkwOQ@@.jpg,"The Flintstones and the Rubbles are modern stone-age families. Fred and Barney work at Slate and Company, mining rock. Fred gives Barney some money so he and Betty can adopt a baby. When Fred and Barney take a test to determine who should become the new associate vice president, Barney returns the favor by switching his test answers for Fred's, whose answers aren't very good. Fred gets the executive position, but little does he know that he's being manipulated by his boss to be the fall guy for an embezzlement scheme.",5,['91'],The Flintstones,84142,1994,95
"['Ray Romano', 'John Leguizamo', 'Denis Leary', 'Goran Visnjic']","['Argentina:Atp', 'Australia:G', 'Australia:PG::(Google Play)', 'Belgium:AL/Tous', 'Brazil:Livre', 'Bulgaria:A', 'Canada:G', 'Chile:TE', 'Colombia:T', 'Czechia:U', 'Denmark:A', 'Denmark:7::(DVD rating)', 'Egypt:G', 'Finland:K-7', 'France:Tous publics', 'France:7::(TV rating)', 'Germany:0', 'Greece:K', 'Hong Kong:I', 'Hungary:KN', 'Iceland:L', 'India:U', 'Indonesia:SU', 'Indonesia:R::(TV rating)', 'Ireland:G', 'Israel:6+::(self-applied)', 'Italy:T', 'Japan:G', 'Kuwait:PG', 'Lebanon:PG::(self-applied)', 'Lithuania:V', 'Malaysia:U', 'Maldives:PG', 'Mexico:AA', 'Netherlands:AL', 'New Zealand:PG', 'New Zealand:G::(recommended rating)', 'Nigeria:G', 'Norway:7', 'Peru:Apt', 'Philippines:G', 'Poland:b.o.::(TV rating)', 'Portugal:M/6', 'Romania:A.G.', 'Russia:0+', 'Russia:6+::(new rating)', 'Saudi Arabia:G', 'Singapore:G', 'South Africa:A', 'South Korea:All', 'South Korea:7::(VHS and DVD rating)', 'Spain:A', 'Sweden:7', 'Switzerland:7::(canton of Geneva)', 'Switzerland:7::(canton of Vaud)', 'Switzerland:6::(canton of the Grisons)', 'Taiwan:0+', 'Thailand:ALL::(self-applied)', 'Turkey:G::(self-applied)', 'United Kingdom:U', 'United Kingdom:PG::(Google Play)', 'United States:TV-PG::(ABC Family)', 'United States:PG::(Approved No. 38658)', 'United States:TV-Y7::(Disney Channel)', 'United States:TV-G::(Fox Movie Channel)', 'Ukraine:ZA', 'United Arab Emirates:FAM::(self-applied)', 'Vietnam:P']","['Chris Wedge', 'Carlos Saldanha']","['Animation', 'Adventure', 'Comedy', 'Family']",https://m.media-amazon.com/images/M/MV5BOGEwMTQyMDktMWUwZC00MzExLTg1MGMtYWJiNWNhMzIyMGU5XkEyXkFqcGdeQXVyOTYyMTY2NzQ@.jpg,"Back when the Earth was being overrun by glaciers, and animals were scurrying to save themselves from the upcoming Ice Age, a sloth named Sid, a woolly mammoth named Manny, and a saber-toothed tiger named Diego are forced to become unlikely heroes. The three reluctantly come together when they have to return a human child to its father while braving the deadly elements of the impending Ice Age.",7.5,['81'],Ice Age,502872,2002,96
"['Ewan McGregor', 'Albert Finney', 'Billy Crudup', 'Jessica Lange']","['Argentina:Atp', 'Australia:PG', 'Brazil:Livre', 'Bulgaria:B', 'Canada:PG::(Alberta)', 'Canada:G::(Québec)', 'Czechia:U', 'Denmark:7', 'Ecuador:12::(self-applied)', 'Egypt:R::(self-applied)', 'Finland:K-11/9', 'Finland:K-12/9', 'France:Tous publics', 'Germany:6', 'Hong Kong:IIA', 'Hungary:12', 'Iceland:L', 'India:U', 'Ireland:12', 'Italy:T', 'Japan:G', 'Lithuania:N-7', 'Malaysia:U', 'Mexico:B', 'Netherlands:MG6', 'Netherlands:6::(video rating)', 'New Zealand:PG', 'Nigeria:G', 'Norway:11', 'Peru:Apt', 'Philippines:PG-13', 'Poland:12::(self-applied)', 'Portugal:M/12', 'Russia:0+', 'Saudi Arabia:G', 'Singapore:NC16', 'Singapore:PG::(edited)', 'South Korea:12', 'Spain:A', 'Sweden:11', 'Switzerland:12::(canton of Zurich)', 'Taiwan:GP', 'Thailand:G', 'Turkey:G', 'United Kingdom:PG', 'United States:TV-14', 'United States:PG-13', 'Ukraine:ZA', 'United Arab Emirates:15+::(self-applied)', 'Vietnam:P']",['Tim Burton'],"['Adventure', 'Drama', 'Fantasy', 'Romance']",https://m.media-amazon.com/images/M/MV5BZTNlNTQzMGEtYjU4Yi00MzEzLThmMTQtNmM0NzcxZWI1MTk0XkEyXkFqcGdeQXVyMjUzOTY1NTc@.jpg,"United Press International journalist Will Bloom and his French freelance photojournalist wife Josephine Bloom, who is pregnant with their first child, leave their Paris base to return to Will's hometown of Ashton, Alabama on the news that his father, Edward Bloom, stricken with cancer, will soon die, he being taken off chemotherapy treatment. Although connected indirectly through Will's mother/Edward's wife, Sandra Bloom, Will has been estranged from his father for three years since his and Josephine's wedding. Will's issue with his father is the fanciful tales Edward has told of his life all his life, not only to Will but the whole world. As a child when Edward was largely absent as a traveling salesman, Will believed those stories, but now realizes that he does not know his father, who, as he continues to tell these stories, he will never get to know unless Edward comes clean with the truth before he dies. On the brink of his own family life beginning, Will does not want to be the kind of father Edward has been to him. One of those stories from Edward's childhood - that he saw his own death in the glass eye of a witch - led to him embracing life since he would not have to fear death knowing when and how it would eventually come. The question is whether Will will be able to reconcile Edward's stories against his real life, either directly from Edward before he dies and/or from other sources, and thus allow Will to come to a new understanding of himself and his life, past, present and future.",8,['125'],Big Fish,451304,2003,97
"['Tom Hanks', 'David Morse', 'Bonnie Hunt', 'Michael Clarke Duncan']","['Argentina:16', 'Argentina:18::(cable rating)', 'Australia:MA15+', 'Austria:14', 'Belgium:KT/EA', 'Brazil:18', 'Brazil:14', 'Brazil:16', 'Canada:14A::(Alberta/British Columbia/Manitoba)', 'Canada:14::(Nova Scotia)', 'Canada:AA::(Ontario)', 'Canada:13+::(Quebec)', 'Denmark:15', 'Ecuador:12::(self-applied)', 'Egypt:18+::(self-applied)', 'Finland:K-16', 'Finland:K-14', 'France:12', 'France:Tous publics avec avertissement::(Blu-ray)', 'France:16::(self-applied)', 'Germany:12', 'Hong Kong:IIB', 'Hungary:18', 'Hungary:16::(DVD)', 'Iceland:16', 'India:UA::(Bangalore)', 'India:A::(Mumbai)', 'Indonesia:18+::(self-applied)', 'Ireland:18', 'Israel:16::(self-applied)', 'Italy:T', 'Japan:PG-12', 'Malaysia:U', 'Mexico:B', 'Netherlands:16', 'Netherlands:12::(TV rating)', 'New Zealand:R16', 'Nigeria:15', 'Norway:15', 'Peru:14', 'Philippines:PG-13', 'Poland:18', 'Portugal:M/16', 'Russia:14+', 'Saudi Arabia:R12', 'Singapore:M18::(DVD rating)', 'Singapore:PG', 'Singapore:R(A)', 'South Africa:16', 'South Korea:18', 'South Korea:15::(cable rating)', 'Spain:13', 'Spain:16::(TV rating)', 'Sweden:15', 'Switzerland:16::(canton of Geneva)', 'Switzerland:16::(canton of Vaud)', 'Taiwan:0+', 'Thailand:Not Rated::(self-applied)', 'Turkey:18+::(self-applied)', 'United Kingdom:18', 'United States:TV-14::(LV, TV Rating.)', 'United States:R::(No. 37056)', 'United Arab Emirates:18+']",['Frank Darabont'],"['Crime', 'Drama', 'Fantasy', 'Mystery']",https://m.media-amazon.com/images/M/MV5BMTUxMzQyNjA5MF5BMl5BanBnXkFtZTYwOTU2NTY3.jpg,Based on Stephen King's 1996 novel of the same name. Stars Tom Hanks as a death row corrections officer during the U.S. Great Depression who witnesses supernatural events that occur after an enigmatic inmate (Michael Clarke Duncan) is brought to his facility.,8.6,['189'],The Green Mile,1358507,1999,98
"['Julie Andrews', 'Christopher Plummer', 'Eleanor Parker', 'Richard Haydn']","['Argentina:Atp', 'Australia:G', 'Brazil:Livre', 'Canada:G::(Manitoba/Nova Scotia/Quebec)', 'Canada:F::(Ontario)', 'Canada:G::(video rating)', 'Denmark:A', 'Finland:S', 'France:Tous publics', 'Germany:6', 'Hong Kong:I', 'Hungary:12', 'Iceland:L', 'India:U', 'Indonesia:21::(self-applied)', 'Ireland:G', 'Israel:6+::(self-applied)', 'Italy:T', 'Japan:G', 'Kuwait:PG', 'Malaysia:U', 'Malaysia:U::(DVD)', 'Mexico:A', 'Netherlands:Unrated', 'Netherlands:AL', 'New Zealand:G', 'Nigeria:G', 'Norway:A::(DVD rating)', 'Norway:A', 'Norway:7', 'Norway:7', 'Peru:Apt', 'Philippines:G::(video rating)', 'Poland:0::(self-applied)', 'Russia:0+', 'Saudi Arabia:G', 'Singapore:G', 'South Africa:A::(self-applied)', 'South Korea:All', 'Spain:A', 'Sweden:11', 'Sweden:Btl', 'Turkey:18+::(self-applied)', 'United Kingdom:U', 'United States:G', 'United States:Approved', 'United Arab Emirates:PG::(self-applied)', 'Vietnam:P', 'West Germany:6::(f)']",['Robert Wise'],"['Biography', 'Drama', 'Family', 'Musical', 'Romance']",https://m.media-amazon.com/images/M/MV5BNWFhNjg3YjctMjg2Ny00YjBkLTg5M2EtMTk2MjA1NDY3NzQ2XkEyXkFqcGdeQXVyMTA0MTM5NjI2.jpg,"In 1930s Austria, a young woman named Maria is failing miserably in her attempts to become a nun. When Navy Captain Georg Von Trapp writes to the abbey asking for a governess that can handle his seven mischievous children, Maria is given the job. His wife is dead, he is often away, and he runs the household as strictly as he does the ships he sails on. The children are unhappy and resentful of the governesses that he keeps hiring and have managed to run each of them off one by one. When Maria arrives, she is initially met with the same hostility, but her kindness, understanding, and sense of fun soon draws the children to her and brings some much-needed joy into all their lives, including the Captain's. Eventually he and Maria find themselves falling in love, even though he is already engaged to a Baroness named Elsa and Maria is still a postulant. The romance makes them both start questioning the decisions they have made. Their personal conflicts soon become overshadowed, however, by world events. Austria is about to come under Germany's control, and the Captain may soon find himself drafted into the German Navy and forced to fight against his own country.",8.1,['172'],The Sound of Music,248818,1965,99
"['Morgan Freeman', 'Andrew Kevin Walker', 'Daniel Zacapa', 'Brad Pitt']","['Argentina:16', 'Argentina:18::(cable rating)', 'Australia:R18+', 'Belgium:KNT/ENA', 'Brazil:14', 'Brazil:16', 'Bulgaria:D', 'Canada:18A::(Canadian Home Video rating)', 'Canada:R::(Manitoba)', 'Canada:18::(Nova Scotia)', 'Canada:16+::(Quebec)', 'Canada:14A::(Alberta)', 'Canada:R::(Ontario)', 'Canada:AA::(Ontario)', 'Chile:18', 'Denmark:16', 'Egypt:R', 'Finland:K-16', 'Finland:K-15/13', 'Finland:K-16/13', 'France:12', 'Germany:16::(nf)', 'Hong Kong:IIB', 'Hungary:18', 'Iceland:16', 'India:A', 'India:18::(self-applied)', 'Indonesia:21::(self-applied)', 'Ireland:18', 'Israel:18', 'Israel:16', 'Italy:T', 'Japan:R18+', 'Maldives:18+R', 'Mexico:B15', 'Netherlands:16', 'New Zealand:R18', 'Norway:15::(VOD)', 'Norway:18::(cinema rating)', 'Peru:18', 'Philippines:R-18', 'Poland:18::(self-applied)', 'Portugal:M/16', 'Russia:18+', 'Singapore:M18', 'Singapore:PG', 'South Africa:16::(self-applied)', 'South Korea:18', 'Spain:18', 'Sweden:15', 'Taiwan:R::(self-applied)', 'Thailand:u 18+::(self-applied)', 'Turkey:13+', 'United Kingdom:18', 'United States:TV-14::(DLV, TV Rating.)', 'United States:R', 'United Arab Emirates:18+']",['David Fincher'],"['Crime', 'Drama', 'Mystery', 'Thriller']",https://m.media-amazon.com/images/M/MV5BOTUwODM5MTctZjczMi00OTk4LTg3NWUtNmVhMTAzNTNjYjcyXkEyXkFqcGdeQXVyNjU0OTQ0OTY@.jpg,"A film about two homicide detectives' (Morgan Freeman and Brad Pitt) desperate hunt for a serial killer who justifies his crimes as absolution for the world's ignorance of the Seven Deadly Sins. The movie takes us from the tortured remains of one victim to the next as the sociopathic ""John Doe"" (Kevin Spacey) sermonizes to Detectives Somerset and Mills -- one sin at a time. The sin of Gluttony comes first and the murderer's terrible capacity is graphically demonstrated in the dark and subdued tones characteristic of film noir. The seasoned and cultured but jaded Somerset researches the Seven Deadly Sins in an effort to understand the killer's modus operandi while the bright but green and impulsive Detective Mills (Pitt) scoffs at his efforts to get inside the mind of a killer...",8.6,['127'],Se7en,1730348,1995,100
"['Stacy Keach', 'John Hammond', 'Julia Duffy', 'Robin Gammell']","['Argentina:13', 'Germany:12', 'Singapore:PG', 'United States:TV-PG::(self-applied)']",[],"['Drama', 'History', 'War']",https://m.media-amazon.com/images/M/MV5BMTQ2NTU0Nzg5NV5BMl5BanBnXkFtZTcwMTkwMDAzMQ@@.jpg,No outline available.,7.5,['381'],The Blue and the Gray,1798,1982,101
"['Kirk Douglas', 'James Mason', 'Paul Lukas', 'Peter Lorre']","['Argentina:Atp', 'Australia:G', 'Australia:PG', 'Australia:NRC', 'Brazil:Livre', 'Canada:G::(Manitoba/Nova Scotia/Quebec)', 'Canada:F::(Ontario)', 'Canada:G::(video rating)', 'Finland:K-8', 'Finland:K-12', 'France:Tous publics', 'Iceland:L', 'Italy:T', 'Japan:G', 'New Zealand:G', 'Norway:11', 'Norway:12', 'Peru:Apt', 'Portugal:M/6', 'Spain:A', 'Sweden:15', 'Sweden:11', 'Sweden:Btl', 'United Kingdom:U', 'United Kingdom:U::(video rating)', 'United States:G', 'United States:Approved', 'West Germany:12']",['Richard Fleischer'],"['Adventure', 'Drama', 'Family', 'Fantasy', 'Sci-Fi']",https://m.media-amazon.com/images/M/MV5BODYxOTMyM2EtNzUzNC00Yjg2LTg3MjYtZTIyNjhiYzc1NTlkXkEyXkFqcGdeQXVyNjc1NTYyMjg@.jpg,"The oceans during the late 1800s are no longer safe; many ships have been lost. Sailors have returned to port with stories of a vicious narwhal (a giant whale with a long horn) which sinks their ships. A naturalist, Professor (Pierre) Aronnax, his assistant, Conseil, and a professional whaler, Ned Land, join a US expedition which attempts to unravel the mystery.",7.2,['127'],"20,000 Leagues Under the Sea",36000,1954,102
